{
  "schemaVersion": 2,
  "id": "zenx-subagents",
  "name": "Subagents",
  "version": "1.0.0",
  "description": "Create and inspect native child Threads.",
  "compatibility": {
    "zenx": ">=0.1.0 <0.2.0"
  },
  "runtime": {
    "type": "bundled",
    "entry": "./dist/runtime.js"
  },
  "mainDocument": "Subagents tools: create, list, send, read.",
  "provider": {
    "id": "zenx-app-server",
    "platforms": ["*"],
    "interactionModes": ["background_safe"],
    "capabilities": ["zenx.subagents.manage"]
  },
  "permissions": [
    {
      "id": "zenx-subagents.read",
      "title": "Read Threads",
      "description": "Read native Thread relationships and public history.",
      "scope": "workspace"
    },
    {
      "id": "zenx-subagents.write",
      "title": "Manage child Threads",
      "description": "Create native child Threads and submit explicit messages.",
      "scope": "local-device"
    }
  ],
  "tools": [
    {
      "name": "zenx_subagents_create",
      "description": "Create a native child Thread. side-chat snapshots the full parent context and waits for the user without starting a Turn. fresh/fork may optionally submit an explicit task; delivery reports acceptance, not completion. Optional model/effort take effect atomically at creation; omit both to inherit. Discover model keys with zenx_models_list.",
      "inputSchema": {
        "type": "object",
        "properties": {
          "parentThreadId": {
            "type": "string"
          },
          "mode": {
            "type": "string",
            "enum": ["fresh", "fork", "side-chat"]
          },
          "model": {
            "type": "string",
            "description": "Opaque model key from zenx_models_list, or an unambiguous model ID. Omit to inherit."
          },
          "effort": {
            "type": "string",
            "description": "Supported reasoning effort. Omit to keep inherited effort when supported, otherwise use the selected model default."
          },
          "title": {
            "type": "string",
            "maxLength": 256
          },
          "task": {
            "type": "string",
            "maxLength": 100000
          }
        },
        "required": ["mode"],
        "additionalProperties": false
      },
      "permissions": ["zenx-subagents.write"],
      "interactionMode": "background_safe",
      "capabilities": ["zenx.subagents.manage"],
      "maxOutputBytes": 524288
    },
    {
      "name": "zenx_subagents_list",
      "description": "List native descendant Thread summaries for a parent Thread, including canonical relationships and status.",
      "inputSchema": {
        "type": "object",
        "properties": {
          "parentThreadId": {
            "type": "string"
          }
        },
        "additionalProperties": false
      },
      "permissions": ["zenx-subagents.read"],
      "interactionMode": "background_safe",
      "capabilities": ["zenx.subagents.manage"],
      "maxOutputBytes": 524288
    },
    {
      "name": "zenx_subagents_send",
      "description": "Send text to a Thread using the standard queue, guidance, or replacement behavior.",
      "inputSchema": {
        "type": "object",
        "properties": {
          "target": {
            "type": "string",
            "description": "Full Thread ID, unique ID prefix, or exact title. Ambiguous targets return candidates without writing."
          },
          "workspace": {
            "type": "string",
            "description": "Optional workspace path to disambiguate the target."
          },
          "messageType": {
            "type": "string",
            "enum": ["follow_up", "guidance", "replacement"],
            "description": "follow_up: do this after current work; guidance: add guidance to current work; replacement: interrupt current work and do this instead. Omit to use the saved ZenX send preference."
          },
          "text": {
            "type": "string"
          }
        },
        "required": ["target", "text"],
        "additionalProperties": false
      },
      "permissions": ["zenx-subagents.write"],
      "interactionMode": "background_safe",
      "capabilities": ["zenx.subagents.manage"],
      "maxOutputBytes": 524288
    },
    {
      "name": "zenx_subagents_read",
      "description": "Read the existing public Thread history projection, including actual Agent messages.",
      "inputSchema": {
        "type": "object",
        "properties": {
          "target": {
            "type": "string",
            "description": "Full Thread ID, unique ID prefix, or exact title. Ambiguous targets return candidates without writing."
          },
          "workspace": {
            "type": "string",
            "description": "Optional workspace path to disambiguate the target."
          },
          "granularity": {
            "type": "string",
            "enum": ["turns", "items", "agent_messages", "item"]
          },
          "turnId": {
            "type": "string"
          },
          "itemId": {
            "type": "string"
          },
          "cursor": {
            "type": "string"
          },
          "maxTurns": {
            "type": "integer",
            "minimum": 1,
            "maximum": 20
          },
          "maxItemsPerTurn": {
            "type": "integer",
            "minimum": 1,
            "maximum": 25
          }
        },
        "required": ["target"],
        "additionalProperties": false
      },
      "permissions": ["zenx-subagents.read"],
      "interactionMode": "background_safe",
      "capabilities": ["zenx.subagents.manage"],
      "maxOutputBytes": 524288
    }
  ],
  "ui": {
    "bundles": [
      {
        "id": "main",
        "apiVersion": 1,
        "kind": "trusted",
        "entry": "zenx/bundled/subagents-ui"
      }
    ],
    "surfaces": [
      {
        "id": "subagents-panel",
        "bundleId": "main",
        "exportName": "subagents-panel"
      }
    ]
  },
  "contributions": {
    "panels": [
      {
        "id": "subagents",
        "title": "Subagents",
        "surfaceId": "subagents-panel"
      }
    ],
    "commands": [
      {
        "id": "create",
        "title": "Create Subagents",
        "tool": "zenx_subagents_create"
      },
      {
        "id": "list",
        "title": "List Subagents",
        "tool": "zenx_subagents_list"
      },
      {
        "id": "send",
        "title": "Send Subagents",
        "tool": "zenx_subagents_send"
      },
      {
        "id": "read",
        "title": "Read Subagents",
        "tool": "zenx_subagents_read"
      }
    ]
  }
}
